index,AUTHOR,ID,SCORE,CREATED_DATE,TITLE,NUM_COMMENTS,SELFTEXT
43839,kane49,cd2s2i,704,2019-07-14,Its not rigged,29,"That one hit me hard.Dude basically defects (not exactly  voluntary tho), sees the western life, determines thats what he wants for himself and dreams of his idealized version of that.Then murray tells him: ""its all just ment to invoke the illusion of fairness, its all rigged like the games at the faire, its all just a conspiracy to take money from your pocket and give it to the big guys""It dawns on him that he might be right and its not all its cracked up to be but his faith is restored when he wins the big prize with pure skill.""Its not rigged"" I put on a big grin AND THEN THE FUCKING SLOW MOTION STARTS."
53166,IThinkThings,8etvci,701,2018-04-25,So what happens when Beetlejuice comes out?,82,It's gonna be pretty strange when they all see a younger version of Will's mom starring in the film in 4 years.
48685,Dark_Saint,c8zh3j,695,2019-07-04,"Episode Discussion - S03E01 - Suzie, Do You Copy?",2827,"**Season 3 Episode 1:** Suzie, Do You Copy?  **Synopsis:** Summer brings new jobs and budding romance. But the mood shifts when Dustin's radio picks up a Russian broadcast, and Will senses something is wrong.&amp;#x200B;*Please keep all discussions about this episode or previous ones, and do not discuss later episodes as they will spoil it for those who have yet to see them.*  \---  [Netflix](https://www.netflix.com/title/80057281) "
55765,Birth_Defect,7awxkj,684,2017-11-05,"I hope Season 3 introduces and even bigger, stronger bully with an even more powerful mullet",100,By Season 6 the main human antagonist will basically just be Cousin It
64928,khazarboy123,4to6cf,683,2016-07-19,can we talk about the real hero of stranger things?,100,the science teacher mr clarke. 1. buys the radio so they can talk to will 2. explains the ridiculous proposition of how to get to another dimension 3. who foregoes his date to explain to some punk kid how to build a sensory deprivation tank on a weekend nightthis is 1983. there is no internet yet somehow he has all this knowledge. hes either a hero or the real mastermind
45127,420highcharizard,cbhdff,682,2019-07-10,In defence of Max,219,"The closest male to Max was her bro Billy sadly and she knows how terribly he treated the girls in his life. You can kind of see why she would be promoting a suspicious stance on dudes in general and be all for El being independent from Mike. Shes getting a lot of hate for being a bad influence on El but I think her history w Billy plays a factor. Also in the relationship dynamics of the show, it feels like the writers like to exemplify a typical view of a character in their demographic. So with Max, shes acting and saying stuff that is very typical 13 year old girl. I definitely knew girls at that age who said the exact stuff she did when I was growing up. Its for viewers to relate to these characters and be like oh yeah I used to think like that/know someone exactly like that! Its like the stuff Mike and Lucas say about girls also sounds so typical 13 year old boy. Steve and Nancys relationship in S1 is a stereotypical high school relationship. These are all intentional by the writers to evoke emotions from us as viewers. Shes not a bad character, in fact I think shes a really well written one!"
47888,XDElixiRED,c9gwu4,677,2019-07-05,Why so much hate for Suzie?,251,"Susie isnt an idiot, she didnt know it would result in that, she thought Dustin was joking about the end of the world. In here mind she was just thinking  Im having fun with my boyfriend who I cant talk to face to face and havent seen in a week. If anything feel sorry for her, dont hate her."
47849,GlamrockShake,c9hufy,654,2019-07-05,[MAJOR SPOILER] ST4 and Another Castle,119,"Just finished ST3 and what an incredible ride. So many more laughs and tears than any other season so far. But...you didnt come here to hear my take on the season. Fully aware that pen has probably not touched paper beyond basic details, I want to offer a prediction for the next season.***Its no secret that Stranger Things has used pop culture references to set the direction of the plot for the season and specifically with regards to monsters. In Stranger Things, it was the demogorgon from the Dungeons and Dragons game during which we were introduced to the gang. The demogorgon was a monstrous, humanoid entity who could traverse between two worlds, similar to the duality of the D&amp;D monster and its two heads. In Stranger Things 2, we open on the gang arriving to a video arcade. Although Dragons Lair could foreshadow the towering size and scope of the danger they would face in the Mind Flayer, Dig Dug provided a more concise picture of how they would be able to access the monster while in Hawkins. Stranger Things 3 shows the kids sneaking into a film instead of playing a game. Still, the film is George A. Romeros Day of the Dead. Day of the Deads setting is an underground missile base that is reflected in the secret Russian compound which much of the action takes place in. Its also a film about people and what happens when the people we know lose their humanity because theyve been possessed by an evil externality. In Day of the Dead, its a zombie-breeding contagion. In ST3, its the influence of the Mind Flayer. **My Prediction** :With ST3 ending at the end of summer 1985 and seemingly setting up a Thanksgiving reunion for the gang. There is only one piece of media that will be on the teens minds:Super Mario Bros. Released in September of 1985, Super Mario Bros. is a phenomenon and cultural-marker that persists to this day as a reference. I have a feeling that ST4 will open up with the kids all obsessed with the harrowing plight of an Italian plumber as he ventures through pipes and beyond to reach his process and save her from the evil Bowser. Now, **what this means for the story** ;[HUGE SPOILERS]Hopper isnt dead and is trapped in the cell in Kamatchka - a remote Siberian outpost.  Other Reddit and Twitter users have pointed out some very good reasons to have hope. Namely:+ Unlike other beloveds weve lost, Hopper isnt shown dead or dying. + The camera showing us the slow progress of the gate closing and Hoppers glance at it. + Not the American... right after Hoppers death would be a horribly stupid way to foreshadow Modines return as Brenner. If Brenner is going to turn into a Palpatine-level big bad for the series, it would have been more sinister to reveal him in full or in part as unmistakably Brenner. + The music cue (Gabriels cover of Heroes) was the same as the one used when Will was found dead. in Stranger Things.+ Oh look! Its a demogorgon in Russia - wonder where they got that (beside perhaps the gate that Alexei had said they were trying to open over there, but was seemingly blocked by the open one in Hawkins).+ The lack of a happy ending for several characters whose happiness seems deeply tied to Hoppers survival. Looking at these facts, I predict that ST4 will be a rescue operation that sees the gang using Els regained powers to track Hopper to Russia and rescue him the only way a group of 15-21-year-olds could: By going through the Upside Down the way Mario must travel downward through pipes to rescue his princess. Since we saw nothing of the Upside Down this season, I think ST4 will use the shows understandably-astronomic budget to set the majority of the season there. I also expect a sideplot with Brenner (who I believe is still alive - just not in a cage in Russia) and perhaps the return of Kali. The Duffer Brothers have given us so much serendipity throughout this show. In the way, Id love to be wrong and have something even grander or better happen, as long as will gets to just fucking chill for a season and we see more spy work from Dustin, Robin and Steve."
43412,Wheelbarro,cdusrs,654,2019-07-16,If Joyce acts like she cares so much about her son how does she let him walk around with that whack ass haircut?,83,This has bugged me since I started binging season 2. Maybe now the lack of sleep is getting to me.
46336,VS_Sanji,cado5m,648,2019-07-07,Jesus,69,"Anyone else felt emotional during Billy's death scene. Especially when he said ""NO!"". He wasn't letting that monster take anyone else. The dude went through hell this season and was somewhat conscious to what ""he"" was doing. In an earlier episode, I think episode 6 or 7. There was a scene where the mindflayer was talking to El as Billy and Billy shed a tear when the mindflayer said he was going to kill everyone. This season showed me Billy isn't a bad guy. He just had a tough childhood."
47231,DeadPoetAndTheRelic,c9tbl2,636,2019-07-06,Can we get an Alexei Funko POP,51,Slurpie in hand. Please.
44596,kcocesroh,cc0i4o,632,2019-07-11,"Lucas and Max have been singing that song, making fun of Dustin for 3 months.",51,"I just realized that the scene at the end of the last episode where Lucas and Max are singing the Never Ending Story song, is after the ""Three Months Later."" They've probably been making fun of Dustin that the whole time.No wonder Dustin is so sick of it."
48336,Marty_McFlyJR,c99fc6,627,2019-07-05,Uhm... Why so I feel like I'm the only one...,69,"That feels bad about Billy? He was literally a kid abused by his dad who didn't even do what he did on purpose, and he still sacrificed himself for Eleven, yet everybody's like ""oh poor Alexei""...Put some respect on my guy Billy ""the milf-flayer"" Hargrove's name."
