index,AUTHOR,ID,SCORE,CREATED_DATE,TITLE,NUM_COMMENTS,SELFTEXT
45188,aps131997,cbf3yr,1524,2019-07-10,Characters with most spoken lines in Season 1,65,"Hello everyone! I have undertaken a project of logging how many lines each character has per season and episode. A line constitutes of uninterrupted dialogue until someone else talks or the scene or conversation changes, or simply the number of times each person talks. The numbers I have may not be 100% accurate, but I did my best, and I thought it would be fun data to analyze. Here are the results for Season 1 of Stranger Things. 1. Mike Wheeler - 4332. Nancy Wheeler - 3463. Dustin Henderson - 3084. Joyce Byers - 2865. Jim Hopper - 2776. Jonathan Byers - 2697. Lucas Sinclair - 2338. Steve Harrington - 1379. Karen Wheeler - 11110. Eleven/Jane Ives - 10111. Will Byers - 6412. Phil Callahan - 5613. Scott Clarke - 5314. Tommy H. - 4515. Calvin Powell - 4416. Lonnie Byers - 4317. Martin Brenner - 4118. Carol - 3719. Barbara Holland - 3220. Troy - 311st place in each episode in order (number of lines): Joyce (54), Mike (70), Nancy (40), Mike (46), Mike (58), Mike (49), Dustin (66), Mike (69)2nd place in each episode in order (number of lines): Mike (49), Nancy (57), Mike (39), Hopper (40), Dustin (50), Nancy (45), Mike (53), Jonathan (56)3rd place in each episode in order (number of lines): Hopper (46), Joyce (39), Joyce (37), Nancy (37), Nancy (49), Dustin (43), Hopper (36), Dustin (49)TRIVIA- Mike is the only character to make it to the top 3 every episode of Season 1. He also never scores below second place in any episode of Season 1. - Most prominent season for Mike, Nancy, Joyce, Jonathan, Lucas, and Karen for total number of lines. The number of lines Mike has in Season 1 is the highest of any character from all three seasons. This in part due to less major characters juggling dialogue. - More dialogue doesnt necessitate the most screentime. For example, Eleven has a lot of solo scenes where she doesnt say anything in Season 1, but these are all integral to understanding and developing her character. - Most prominent characters that do not make it to the top 3 for any episode in Season 1: Lucas, Steve, Karen, Eleven and Will- Most lines in an episode: Mike with 70 in ""The Weirdo on Maple Street"" followed by Mile with 69 in The Upside Down and Dustin with 66 in The Bathtub - A lot of supporting characters from season 1 that make it to the top 20 either do not appear past this season  (Barb, Lonnie, Troy) or fade into obscurity (Tommy, Carol)"
57252,ArbitraryDuckling,79j3st,1523,2017-10-29,"I know Maxs brother was an asshole, but we can all agree on one thing:",360,He was so fucking smooth to Mrs. Wheeler. 
46452,allyleitschuh,caayjv,1516,2019-07-07,Mrs Driscoll,113,Did anyone else think Mrs Driscoll was going to explode like the rats when Nancy was with her in the hospital and her heart rate started going up??
46857,lilsunnyXO,ca1aqc,1463,2019-07-07,Did anyone else enjoy when Steve noticed it was eleven ordering ice cream with max?,79,Wait are you even allowed to be here?
57788,BrySighz,79a2m6,1436,2017-10-28,Steve appreciation thread,289,Seriously. From biggest douche to biggest bro. He deserves better than Nancy. Steve ftw. 
44368,ElitePraetorian421,cc93xs,1435,2019-07-12,"{SPOILERS} BLANK is Alive - All evidence, all undeniable proof",239,"Hopper Is Alive*All evidence, all undeniable proof*&amp;#x200B;**Exhibit A**Hopper is missing from the explosion. The shot before the machine explodes killing him shows him standing there. Then the shot where the machine does explode, he is not there. At this angle, he would be shown being obliterated however he is not which implies that he has either been captured or gone through the gate.[Hopper](https://imgur.com/a/Rag8FJx)[No Hopper](https://imgur.com/a/cU2Vd7I)&amp;#x200B;**Exhibit B**During his death scene, the music that plays is the same music from when Wills fake body was pulled from the water. Even the music implies he is not dead.&amp;#x200B;**Exhibit C**We see no dead body. All of the major deaths we see their dead bodies. Benny, Barb, Mews, Bob, and Billy all have their dead bodies shown. The only character that died who didnt have their body shown was Dr Brenner and Hopper. Dr Brenner has been confirmed to have survived and if this really was Hoppers death then they would show his body to confirm it.&amp;#x200B;**Exhibit D**The end credit scene has the line No, not the American. The only person the Russians call in this show the American is Hopper. There was a total of 14 seconds from Joyce closing her eyes to the explosion shot. More than enough time for the Russians to jump in and capture him or for him to jump through the porta;&amp;#x200B;**Exhibit E**David Harbour, the brilliant actor who plays Hopper, has grown a long beard. A beard that someone might have after being locked up in a Russian cell for a while. We know Stranger Things 4 is happening and I believe this is him preparing for the role. He has also been very vague when talking about his last Stranger Things 3 scene and this could be because either he doesn't know or isnt allowed to tell.&amp;#x200B;CASE CLOSED :)"
52951,starletprincecay,8o2vtd,1389,2018-06-02,Am I the only one who feels so bad for Steve?,93,"Like, he spends season one and part of season two trying to love Nancy, and he gets caught up in all of this crazy shit. He's the only one who reacts realistically to any of it too lmao. Like, he was just trying to live a normal life and all of this crazy stuff happens to him. Poor Steve lmao"
49921,solar_vortex07,bg6vfx,1383,2019-04-22,Can we just take a moment to appreciate this shows soundtrack,89,"I looked up some songs from the OST, and I dont think it gets enough love. Works so well."
64634,gordonfroman,4u0jlj,1343,2016-07-22,Jim Hopper may be the most well written police character in a sci if to date.,88,"Everything established within his first few minutes on screen is totally false about his character, we see him wake up chug a beer at like 9 am and down some pills but the second will goes missing his attention is unreleating and focused to such a high degree that he is able to find seriously significant clues early on rather than later like most shows. Not to mention the way he acts around the other characters like wills mom and the kids just brings a smile to my face every time he opens his mouth, he never says anything stupid, leaves out any important details, or says something without good reason for it. "
60601,LordAnubis10,561pua,1343,2016-10-05,Can we talk about my favorite roast of the series?,196,"&gt;""I was thinking, ""Nancy Wheeler, she's not just another suburban girl who thinks she's rebelling by doing exactly what every other suburban girl does until that phase passes and they marry some boring one-time jock who now works sales, and they live out a perfectly boring little life at the end of a cul-de-sac. Exactly like their parents, who they thought were so depressing, but now, hey, they get it.""There are jabs at random characters all the time but Johnathan is straight up brutal what the fuck"
46608,Pilusmagnus,ca6jyl,1331,2019-07-07,Season 3 Conflicts,102, Hopp: how can I accept that my daughter is growing up and changing  &amp;#x200B;Mike: how can I protect my loved ones without stepping on their boundaries  &amp;#x200B;Will: how can I remain a kid when my friends are moving on with their lives&amp;#x200B;Dustin: how do I defeat those russian spies in their secret bunker
46924,bluthbanana88,ca08nj,1320,2019-07-06,(S3 SPOILERS) I just started rewatching E1 of S3 and noticed really nice little detail,27,"So the opening of S3 with Hopper watching TV while Mike and El are in the bedroom. I remember wondering why Hopper looked so cranky watching TV and at first I thought it was simply because Mike was spending too much time with El and Hopper was in a ""protective dad"" mode. While this is obviously true, I realized he was actually watching (I think) Miami Vice. &amp;#x200B;And if you remember, he tells Joyce in the last episode that he can't do 8PM dinner because he wanted to be home in time for Miami Vice because El liked watching it every Friday. &amp;#x200B;So I'm now feeling sad for Hopper in this moment because he's realizing how fast El is growing, and he just wants to spend time with her, and he probably always blocked out that time to watch the show with her but she was starting to spend that time with someone else. EMOTIONS lol"
64178,alexshatberg,4up17i,1313,2016-07-26,[Spoilers] Observation: Each of the show's three main storylines follows its own genre,62,"So it's not hard to notice that for the most part of the series the main characters are divided among three principal storylines: the boys and Eleven, Jonathan and Nancy, and Joyce and Hooper.  Each of those three follows one of the common 80s genres.  The kids are in a Spielbergian adventure story - treading the town on bicycles, dealing with the bullies at school and harboring a fugitive with superpowers.  The teenagers are in a teen horror flick - high school drama, sex, a monster that's kidnapping people.  The adults are in a conspiracy thriller. They get to deal with the nefarious g-men and secret LSD experiments."
61938,RandyHavensAMA,4z7ion,1298,2016-08-23,"I am Randy Havens, I play Mr. Clarke on Stranger Things. Ask me anything!",398,"Let's do this! My Twitter and Insta are both @MrRandyHavens Okay guys, my hands are getting tired and the Mods are like ""Dude! Aren't you exhausted yet?"" I'm gonna dip out for a bit. I'll be back in five hours or so to check back in on any pressing questions you have, so upvote any questions you really wanna see me answer. Thank you all so much for being so nice to me today! And for being fans! You guys are so important to the show, so keep telling your friends to watch and let's get everyone on earth as obsessed with this show as we are!Keep being awesome and I'll see you guys soon! (After today, I'll stop by the sub from time to time to check in with you guys!)I came back! You guys are awesome. And so am I because I'm pretty sure I answered everyone's questions. I'm gonna go play Rocket League now!"
48573,im_missunderstood,c933hj,1260,2019-07-04,A theory for season 4,196,"I believe well start off with a 5 year time jump, then the kids will collect all of the Infinity stones and bring Hopper back from the dead by reversing the Thanos snap"
47261,MeowerPowerTower,c9sj7v,1258,2019-07-06,One of my favorite things this season has been the shows approach to a foreign language.,127,"As a Russian speaker living in the states Im very used to some seriously butchered attempts at Russian on both, big and small screen - immigrants everywhere see it when it comes to their first language.Hearing so many native Russian voices in an American show was awesome. It was such a treat to watch a show without getting stuck on some serious butchering/lack of an honest attempt at my first language. Not only that, but just about every Russian character actually spoke proper russian. There is a sizeable population of Russian speakers in the states after all. I can only hope that the days of complete gibberish being passed off as a foreign language are coming to an end. Never expected such a thing to make me so excited. This season was SO good.RIP Alexei"
58668,oniondasher,6rn5rm,1226,2017-08-04,Realization: Will and Jonathan have the same reaction to the Demogorgon,34,"In the first episode (and again in the last one), Will is confronted by the Demogorgon in the DnD game. What does he do? He casts Fireball.In the last episode, Jonathan traps the Demogorgon in his house. What does he do? He casts Fireball (throws the lighter on the kerosene). Not sure if this is intentional, but I found it funny that both of the Byers boys fight the Demogorgon the same way. Nancy/Jonathan/Steve make a decent ranger/wizard/fighter trio in that last episode. Edit: Will fireballs the hydra in the last episode, not the demogorgon - still applies to the first episode though! (pointed out in the comments)"
45979,beef-a-ronie,cao7xa,1209,2019-07-08,What I loved about Jonathan and Nancy's fight,44,"Both Jonathan and Nancy have valid reasons to be upset and both are blinded by their priveledge. Jonathan comes from a very poor household with a single mother and it is implied in the show that he helps support the family financially. This job is important to his family's well being. Nancy doesn't really think about the ramifications for Jonathan if he loses his job because her family is well off and she's just looking at this job as a step towards a future career.Nancy is being treated horribly by her sexist boss and coworkers. They are degrading to her and make extremely sexist comments around her. Jonathan doesn't realize how bad this is because he's blinded by his priveledge as a male and he's not seeing this first hand.I love how nuanced this is, showing how each is blinded by priveledge (class or gender), but neither one is wrong for being angry. I find this is true to how life often is, where everything isn't always black and white, and I love that they managed to show that so well here."
57933,VeerPratapSingh99,797hit,1200,2017-10-28,EXCUSE ME??? EXCUSE ME???????????,105,"MY IMMERSION WAS RUINED WHEN I NOTICED A MAJOR PLOT HOLE AT THE BEGINNING OF SEASON 2 EPISODE 2. THEY DARED TO INCLUDE A PERIODIC TABLE WITH THE NEWEST ELEMENTS, WHEN THEY WERE ONLY DISCOVERED RECENTLY. DISGUSTING."
49905,1schlick,bh1die,1185,2019-04-24,Theory: Demogorgons are misunderstood.,58,"All they want is food.When not obeying direct orders from the Mind Flayer, they are allowed to roam free and act independently.We can see that Dustin was able to tame Dart while Dart was in this state.The only reason they dislike the cold is because the Mind Flayer programs his hosts to seek cold temperatures, weakening their immune system so that he has better control over them.Theoretically, if Dustin had put Dart in the turtle cage with the hot lamp on high, he couldve saved Dart and potentially tamed him as a pet."
45156,PinkFloyd_Mayweather,cbgi2s,1170,2019-07-10,[SPOILERS] Something Billy did that stuck out to me this season,104,"When he starts to get violent visions from the Mindflayer, him and Karen Wheeler are having a conversation in the back room of the locker room. She starts to apologize for ditching out on their motel meet up, and billy says Karen just get away from meHes really saving her, he realizes something is going on with him and he doesnt want her to get hurt. Just another reason to love Billy, easily my favorite character of season 3"
59864,rexerjo,5ljz3v,1158,2017-01-02,"First kid born in Darwin, Australia in 2017 is a girl named Eleven!",133,I'm kinda impressed! 
34288,niallemac,latggx,1156,2021-02-02,Why does everyone love Billy?,454,He is a total jerk even before the mind flayer he is a jerk to max and Steve he also tries to kill Steve again before the mind flayer and he also went to try and kill Lucas because he was hanging out with max. So why do you like him?
35039,Robot_wars11,jv5jix,1125,2020-11-16,What's your favourite little detail from the show?,320,Mine is probably the blue hairband Hopper got from his daughter and gave to Eleven. But that's probably the most popular one so I'll throw another into the mix - In season 3 when Mike and Eleven are broken up their clothes share the same colour scheme to show they're still together even when apart.
62412,RossPartridgeAMA,4xzksd,1113,2016-08-16,I am Ross Partridge and I play Lonnie on Stranger Things AMA,104,"Currently in NYC working on Billions. I wrote, directed and starred in the film LAMB that came out this past January."
59022,Kokorikai,69sewb,1102,2017-05-07,What's the Demogorgon's favorite type of food?,54,Barbeque.
60208,Dark_Saint,5c35pp,1065,2016-11-09,Let's leave politics out of ST,56,"Today we are getting flooded with posts about the US election, so to keep this sub civil and on point we will be removing any posts that reference the election in any way. If you wish to discusss this election there are many subs to choose from /r/politics, /r/worldnews, /r/PoliticalDiscussion, /r/worldpolitics, /r/usa just to name a few.Thanks."
45006,ChemistryIsPunk,cbm559,1047,2019-07-10,Will was extremely relatable this season,72,"Poor kid just wanted to play some D&amp;D while his friends were distracted by relationships and whatnot.  Ill play with you, Will the Wise."
52059,theking4mayor,9dmmgn,1035,2018-09-06,[FAN THEORY] Eleven did not escape Hawkins Lab the way you think she did (and its important),109,"\[Season 1 #spoilers ahead\]&amp;#x200B;When searching for Will at the beginning of Season 1, we see the search party find torn fabric from Elevens (Eles) hospital gown on the drain pipe near the lab and distortion on the video footage of the security camera leading us to believe that the government edited/faked the security tape and Ele escaped the facility through the pipe. THIS IS NEARLY IMPOSSIBLE.*Let me explain why and why it is important.*I discovered this a few months ago I was making a [fan edit](https://youtu.be/POw5Jsp8aEk) in which I compiled all of the facility footage of Elevens flashbacks into a single video. At the time of the incident in which Ele escaped, Ele was locked securely in the hibernation tank which was mechanically locked from the outside.Now, I cant say with 100% certainty that she didnt use her telekinetic powers to open the tank and escape on foot, but considering the scene, this is very unlikely. Here is why:&amp;#x200B;1. Given the chaos of the rupture and the release of the Demogorgon, security would have definitely made securing The Asset a number one priority if she had been running around. The reason we dont see this is that since Ele is presumed to be still in the tank (which is locked with the window covered), security presumed that Ele was still safely inside the tank and staying there was the best place for her, making other tasks a priority, such as securing higher ranking government officials who were present on the lower catwalk. They most likely didnt even realize she was missing until after the Demogorgon had left the room when they when to rescue her from the tank.2. The nature of the rift shows us what happened. In all other instances of crossing the vail into the upside-down, travel occurs by opening a portal in a wall, tree, or some other vertical object, leaving very little notice in the physical world unless you are taking notice and it heals itself almost immediately.&amp;#x200B;However, when the rift is opened, it splits from the middle of the rift out across the surfaces of the room. This is because unlike a normal opening of the vail, Ele this time instead teleported. Being suspended in mid-air (or water) in the center of the room and being panicked by the Demogorgon, she acted unintentionally with her only thought of going to a safe space, using a power she not only didnt know she had but also had no way to control.*You might now think this is where she escaped the facility*, *but no*. Because if she did, she wouldnt be wearing the hospital gown, but the submersion suit. The only safe place she knows is her room (the larger cell). On the bottom shelves of her room we see what looks like some towels and are probably extra clothes as well, or new clothes laid out on the bed for when she comes back from the tank.She most likely teleported back to her room, dried and changed herself. Then realizing she could teleport, tried to do it again and failed from exhaustion. She was however, likely to open up a normal portal in the vail and traveled through that, escaping to Mirkwood Forest.&amp;#x200B;Now, I imagine it is mostly believed that the Demogorgon traveled through the rift into the lab, but I think this is also incorrect. In the footage of ""the incident"", we can hear the Demogorgon in the room and see people scrambling about before the rift opens up and the cracks form in the wall. I think that Ele accidentally teleported the Demogorgon into the lab when she teleported out.The Demogorgon confused at suddenly being in an alien world went nuts, attacking everything in sight. The Demogorgon being intelligent and finally realizing what was going on, began to hunt Eleven, knowing that she was a threat. Eventually he tracked down the trail of Eleven, discovering the tears in the vail Ele created, and using those to track her and escape the facility.**Here is why it is important!**Ele, now in Mirkwood and being chased by the Demogorgon, rips her gown and creates several other portals in trees and eventually in Wills house. **The Demogorgon cannot create its own portals in the vail**, it can only use the ones created by Eleven.Will, traveling home from DnD, thinks the Demogorgon is chasing him, but its not! Its chasing Eleven! But will doesnt know this. When he thinks that he running away from the Demogorgon, he is actually moving in parallel to the Demogorgon/Ele chase through Mirkwood, as they pop in and out from the upside-down.Eventually Will catches up to the chase, getting in between Ele and the Demogorgon in the shed. The Demogorgon, being newly familiar with humans, sees Will, thinking Small One, and grabs Will mistaking him for Eleven, (or Will ran through a tear in the vail himself trying to escape the Demogorgon). Thinking it succeeded in it's chase, the Demogorgon returns to the upside-down and gives up his pursuit of Ele.&amp;#x200B;So, when Ele later tells Mike that it is her fault that Will was in the upside down, she doesnt mean that it is because she opened up the rip between worlds, but more literally because she led the Demogorgon to Will and allowed him to be captured, facilitating her own escape. This is why she is so extremely racked with guilt.As she continues her independent adventures outside the facility with the gang, she increases her human empathy as well as the strength of her powers. It is with this emotional connection that she is finally able to successfully use her teleportation powers again (on purpose this time) to teleport the Demogorgon back to the upside-down. She doesnt kill the Demogorgon, but asserts her dominance over it, which is why that particular instance of the Demogorgon no longer tried to cross over into the normal world again.This also makes Hawkins Middle School a secondary hotspot of cross-world activity, thus attracting the Shadow Monster/Mind Flayer, which seems to have a psychic connection with the Demogorgons, or Demogorgi if you prefer.&amp;#x200B;*So what do you think? Do I got something here? Has this come up before? Let me know in the comments! Thanks!*"
65215,prolix,4te9fe,1034,2016-07-18,Does anybody else agree that this is one of the best shows ever created?,157,The attention to detail was impeccable from the dungeon and dragons right down to the amazing sound track. It's almost like the writers can read our minds on what we the people really want in a series. I feel the sudden need to research other works by the Duffer brothers after finishing the first season of this show.
46052,CaptCanada924,calzyo,953,2019-07-08,Awesome detail about episode title,27,"I havent seen anyone mention this, but episode six has an amazing title. E Pluribus Unum is latin for From Many, One. It is the motto of the United States, so when I first saw the title I assumed it was referring to Fourth of July celebrations. But then, we get that amazing scene at the end of everyone melding into the mind flayer. An amazingly well done double meaning"
65484,Dark_Saint,4sxyyb,952,2016-07-15,Season Finale Episode Discussion - S01E08 - The Upside Down,4016,"Stranger Things Episode Discussion - S01E08 - The Upside Down---Dr. Brenner holds Hopper and Joyce for questioning while the boys wait with Eleven in the gym. Back at Will's, Nancy and Jonathan prepare for battle.---***Please keep all discussions about this episode or previous ones, and do not discuss later episodes as they might spoil it for those who have yet to see them.***---[Netflix](https://www.netflix.com/title/80057281) "
56215,arhipel,7aar6i,932,2017-11-02,Mike is so underrated this season [Spoiler],179,"So, this season a lot of people only mentioned Mike in terms of his relationship with El. Even though I love it, Mike is more than that.First of all, he is a really good friend to Will. No doubt, everyone knows it, I think I don't have to explain this.Second, he figured out so many things. Looks like a lot of people don't notice it, but I would argue that he probably the person who understands the monster best, besides Will maybe.Like, he mentioned that Will could be the spy, and he figured out that Will is actually a double spy. He knew that Will has to be put to sleep so that the monster can't spy them. He figured out that if they stop the boss, they also could stop his armies. He noticed that Will know how to stop the monster and suggested that they have to talk to him in an unknown place. He also warned the others that Will will die if they defeat the monster.And, remember when they just sit around in the Byers house after they come back from the Lab? He lifted the mood and initiated the discussion and action by bringing back the fact that Bob was the founder of Hawkins High AV and he doesn't want them to waste his sacrifice.So, even though he probably got the least character development, he is still a brilliant character, beyond his relationship with El."
