index,AUTHOR,ID,SCORE,CREATED_DATE,TITLE,NUM_COMMENTS,SELFTEXT
43139,Utgoffalec,cees1t,21899,2019-07-17,"Hi! My name is Alec Utgoff and I play Dr. Alexei on ST, Ask Me Anything!",1659,You can follow me on Twitter @AlecUtgoff and Instagram alec_utgoffProof: https://i.redd.it/2h43ow345ia31.png
42027,coloredneon,cibkdz,16975,2019-07-27,"Wills storyline doesnt seem to be about sexuality, it seems to be that he missed a year of his childhood and he wants it back.",813,"I keep seeing posts and comments about Wills sexuality. Its weird because thats not what I got from that entire scene.Will missed a year of his life. He explained this not once but twice this season. His friends got to develop, explore their thoughts and grow into themselves.Will was just an empty shell during the last year of his childhood. He just wants to play games with his friends, whom were all just as obsessed about kid crap the year before.During the scene, Will was frustrated because he didnt realize when all this happened. Imagine missing key chunks in your life that were defining moments for your friends."
43275,brettcliffordgelman,ce4jk4,13026,2019-07-16,Im Brett Gelman aka Murray from Stranger Things. AMA.,1225,"Hi Reddit! Brett Gelman here. Im an actor and comedian who can be seen in STRANGER THINGS, FLEABAG, CAMPING on HBO, ANOTHER PERIOD, to name a few. Looking forward to talking to you all!Instagram: https://www.instagram.com/brettgelman/Proof: https://i.redd.it/5uxw8zvg3la31.jpg"
45096,AndreyIvchenko,cbiolx,10260,2019-07-10,"Hello Reddit family, it's Andrey Ivchenko here, best known as your heartbreaking Terminator villain GRIGORI from the new season 3 of ""Stranger Things""! AMA!",1114,"Really excited to be here with you all today for this AMA. Don't be scared, Im really not so bad of a guy.... or am I? Guess you will have to ask me some questions and find out. This is my first AMA so be gentle or I may have to go full Russian Terminator on you! :) Follow me on IG @theandreyivchenko, FB @AndreyIvchenko, and Twitter @AndreyIvchenko Alright guys, let's do this!!!Proof:  https://i.redd.it/uawnhcvl4c931.jpgMore proof: https://i.redd.it/ybf0746k4c931.jpg"
44863,DacreMontgomeryAMA,cbq91l,7308,2019-07-11,I am Dacre Montgomery I play Billy Hargrove AMA,3062,"Hi am Dacre Montgomery and I play Billy on Stranger ThingsCheck out my podcast DKMH, out now! https://podcasts.apple.com/us/podcast/dkmh/id1466872558"
45289,kingsark,cbbap4,7084,2019-07-10,The reason why Will only had a few lines this season that more people should know about.,359,He had a serious back injury from carrying the show too much last season
63513,DavidHarbourAMA,4vtvbq,6353,2016-08-02,"I am David Harbour, I play Jim Hopper in Stanger Things AMA",787,@DavidKHarbour is my twitterhttps://twitter.com/DavidKHarbour/status/760537430508339200
59453,SadMoma,5tg5yq,3636,2017-02-11,I Avoided Stranger Things because of all the hype. I feel real stupid right now.,259,"Holy fucking shit fuck this is probably the best thing Netflix will ever produce. The acting, outstanding.The Writing, incredible.The music, Orgasmic.I thought everyone was circlejerking and overhyping the show but I sat down to see how the first two episodes were, and not even realizing I was on Episode four I was absolutely in love with the show. Cannot WAIT For Season 2!EDIT 1: To everyone making ""you're stupid for thinking you were to cool for a show."" Just stop, I'm an adult who's running a business, I don't have nearly as much time as I do for netflix anymore. When you have a family, band, and business to run, try sitting down uninterrupted for 50 minute every day to watch a show. EDIT 2: Since people are literally threatening to shit post my business and harassing me for absolutely no reason, allow me to put a SECOND Edit. I run a business in Philadelphia, I miss the days when I could just sit down and just enjoy the fuck out of a movie or TV show. I can't do that anymore. I had a lot of people tell me how great it was, but with the lack of time I have it makes it hard for me to just invest in these kinds of shows. I got home pretty late one night, and decided I would watch the first episode of Stranger Things, a show that I've had memes and references shove in my face on social media. It was such an interesting show, and sooner than I knew it, I'd watched more than one episode and it time for me to start getting ready for work. I'm absolutely in love with the show, like I said the writing, characters, acting, and just the overall tones and beauty of the show are so fresh and unique. If you have some sort of problem with me loving a TV show and still living a busy life than cool, give me all the down votes you want. That's not how Friends should Treat Friends, and it just goes to show who the real mouth breathers are in this sub. "
53392,PetevonPete,7zz3xu,3503,2018-02-24,It's kind of a miracle we don't all hate Mike in Season 2.,239,"Ever since I came across [this video](https://www.youtube.com/watch?v=mFohtfAXbuE), I've been appreciating how the entire fanbase somehow didn't turn against Mike's character in Season 2. In pretty much every scene, he's constantly irritated, controlling, and whining about something to his friends and is a straight up dick to Max for no good reason. He's not really what you would call a likable character by any definition. Sure, the show makes it clear *why* he's behaving this way, but that very often doesn't matter to audiences, especially with kid characters. Audiences usually have very little patience for teenage characters behaving like teenagers.I'm not exactly sure why Mike *didn't* annoy me in Season 2 but the writers really deserve praise for tackling a character arc that could have very, *very* easily backfired and ruined the show for a lot of people."
50229,Implyingi,b4oxl1,3431,2019-03-23,My 77 year old Grandmother's thoughts of Stranger Things Season 1 (Episode 1 and 2),150,"My grandmother was fed up with normal TV so I decided to show her Netflix and we ended up watching 2 episodes of Stranger Things. Here's her thoughts so far.Hopper - ""He's the lazy cop but he has a good heart really I think""Eleven - ""She has something in her head, poor little thing""Joyce Byers - ""Poor, poor lady, (she) is a good actor I really feel sorry for her""Steve - ""That boy is after one thing, he's a bad influence. Smoking AND drinking!""Nancy - ""Silly young girl, her friend (Barb) had more sense!""Mike - ""A GOOD boy"" (Emphasis for comparison to Steve I think?)Dustin - ""A funny smile for a funny boy he reminds me of you""  - Thanks! Jonathan Byers - ""Needs a haircut but I feel bad for him because his dad is a no-good'n""And my personal favourite:Bobby (The diner owner who finds Eleven) - ""Poor man, why did those nasty men kill him? I hope he kills them back!""(He's dead, how can he ""Kill them back""?)""Oh I don't know; there's a monster isn't there?""That's all she had to say about characters. And her overall thoughts on the show was:""It's a good show, it's not too violent and not too scary; I like it!"" We plan to watch more and if people liked this perhaps I'll post her future thoughts on the show. I'll even be happy to ask appropriate comment questions.Bonus:(Episode 2) As Joyce Byers moves towards the stereo in Will's room the lights flicker and a figure presses against the wall from the inside. *Gasps* ""ITS A WALL MAN!""Thanks for reading. "
65220,ortegasb,4te6kx,3356,2016-07-18,I think we've just entered the era of the 8+ hour movie,186,"Don't get me wrong, I've binged entire seasons before and many were Netflix originals. This series, however, felt like it was actually amplified by it. The chapter cuts made sense but including chapters that started from the end of the last chapter kept an up-tempo pace I haven't seen in a series before. Very excited for a new distribution method that allows media to focus on long-form. "
53111,lil_oleary,8ho9e0,3025,2018-05-07,Detail In Stranger Things. SPOILERS,84,"[I'm new to both reddit and Stranger Things. But a huge marvel fan.In the first episode when Will and Dustin are racing, Will specifically asks for his 'X-Men: #134'.'X-Men: #134' revolves around Jean Grey who essentially has near enough the same powers as Eleven (but is a lot more powerful).At one point in this issue of X-Men, Jean Grey uses her powers to pin Mastermind against the wall.This 'scene' in the comic is nearly identical to the ending of Stranger Things 1 when Eleven pins the Demogorgon against the chalk board in the classroom!Some people may already know about this small detail but I thought it was really awesome of the Duffer Brothers to add that 'Easter Egg' into the mix.] (/spoiler)"
47669,RickyFaust,c9ll0c,2938,2019-07-05,Anyone else feel bad for Steve Harrington?,378,"His then girlfriend called their relationship ""bullshit"". He gets upstaged by Billy at Basketball practice after which billy beats the shit out of him. He ends season 2 alone outside the Hawkins high school dance. He flirts with girls at his minimum wage ice-cream scooping job where they routinely dunk on him. He's regularly out-smarted by kids, ends up being beaten unconscious by Russian Military, and drugged, all while the only girl he's ever made a genuine connection with comes out as a lesbian when he professes his feelings for her."
47415,Silent_Samazar,c9pjwg,2831,2019-07-06,The most haunting thing about the finale-,79,"somewhere out there, lardass is running around a pool with no one to stop him."
46043,president_of_burundi,cam862,2802,2019-07-08,Steves evolving response to learning crazy shit in stressful situations:,113," **Steve First Season:** Is kinda a dick, gets in a fist-fight, goes to apologize, learns monsters are real when one busts out of the ceiling and tries to kill them.**Response:**This is crazy. Thisiscrazythisiscrazy THIS! IS! CRAZY!  **Steve Second Season:** Fights demodogs in a junkyard. Adopts four children. Learns that the Mind-Flayer wants to take over their dimension.  **Response:**GreatThats just. *Great*. Thats really *great!* *JESUS*.  **Steve Third Season:** Tracks down secret Russian base under a shopping mall, gets tortured by the Soviets while wearing a sailor outfit. Learns that the Mind Flayer is building a massive meat monster.**Response:**So, just to be clear, this big fleshy spider thing that hurt El- its some kinda gigantic weapon, but instead of, like, screws and metal the Mind Flayer made its weaponwith melted people? \**noncommittal* *shrug*\* Yeah, Im just making sure.  This boy is out of fucks to give."
43140,xbuck33,ceeocv,2583,2019-07-17,This is why Steve is the best character,121,"When we see Dustin show up at Scoops Ahoy for the first time, Steve is ecstatic to see him and they do their handshake. Starts pretty normal and ends with a nice short light saber battler where Dustin kills Steve. Great handshake. Star wars themed seems very par for the course for two teens in the 80's.**BUT**At the end of the season we see Steve applying for a job at the movie store, and he is asked his favorite movies. He freezes for a second spits out Animal house to Robin's annoyance and then says Star Wars but in a really unsure way. When asked if he means ""A New Hope"", he says ""a new what?"" When asked which Star Wars, he says the one with the Teddy Bears. So what do we get from this? **Steve couldn't give two shits about Star Wars**. Doesn't care at all. Despite not caring about the movies though, **he's willing to do a super animated handshake in public of a light saber battle with Dustin because Dustin loves it**. Like season 1 Steve wouldn't be caught dead with one of the kids and now we have him publicly doing super nerdy things with a 13 year old. He let Dustin make up this handshake and is completely down doing it anywhere and goes all in on it instead of half trying like the cool kids.Steve is just the best lol"
65356,ehdubya,4tadox,2260,2016-07-17,Mr Wheeler stole every scene he was in.,85,"What did I do? What did Iiiiiiiii dooooOOOOO? (as he continues to enjoy his chicken)""What happened to her hair? Oh my god is she Russian"" ""If there were a girl living in our house we'd know about it... &lt;looks at wife&gt; ...right??""I couldn't get enough of that guy, always asking the important questions"
65167,heyiknowstuff,4tfv8r,2222,2016-07-18,Steve did nothing wrong.,294,"Steve is a giant douche is the consensus about Steves character on this sub. Generally, you can find some version of that statement littered through fan comments. Its time to address this mischaracterization before it gets out of hand. Lets look at some of the common complaints about Steve:&gt;When Steve helped Nancy study he had other intentions.Hes a teenager, of course he wants to bone. When Nancy stopped his advances, he respectfully stepped back and actually did help her study. &gt;Steve having a party and chugging beers is a classic douche move. Again, hes a teenager. We all had parties and shot gunned beers to impress people. During this party he A. made sure to invite Barb and include her in the fun, B. let Nancy make the first move.&gt;Steve broke Jonathans camera.Yeah, thats a pretty good move instead of beating the shit out of Jonathan. The creep took pictures of Nancy taking off her clothes. If someone took a picture of my SO disrobing through a window, from way back in a dark forest, I wouldve freaked the fuck out. At that point in the story, Jonathan deserved to have charges pressed against him. Really though, Steve shouldnt have broken the camera, and just called the police. That said, every single one of you can understand and empathize with the motivation. For Jonathan, having your camera broken is probably a better punishment than being labeled a sexual predator.Oh and Steve bought Jonathan a new camera. Steve let Nancy give it, not taking any of the credit himself. &gt;Steve was a dick about good ol Barb. We dont know what his family life is like  I would also be pretty worried about my parents reaction if they found out I had a party where a friend went missing. May have been a bit selfish and short sighted, but again, hes a teenager. Given enough time, he was able to realize his mistake and went to apologize. Not only did he go to apologize, but he tried to get Nancys mind off the whole thing and was legitimately worried about her. He even expressed these feelings to his dickbag friends  he let his guard down in front of those tools. Steve is emotionally vulnerable, but he is willing to do so for Nancy.Steve also defended Babs to his dickbag friends. He never once made fun of her. &gt;Steve shouldnt have spray painted the sign.He didnt. He told his friend not to do it. Even after bloodied and beaten to a pulp by Jonathan, he confronted his dickbag friends and basically told them to fuck off. Steve also went to the movie theater to clean off the paint that he had nothing to do with. He felt guilty and didnt want Nancys name tarnished throughout the town. Steve was hurt, caught Nancy in what could only be seen as an emotional/tender moment between N&amp;J, and Nancy was unable to offer an explanation. Still, he didnt want the spray paint, and didnt hold it against either Nancy or Jonathan that he got his ass beat. Steve even went to Jonathans house, not expecting Nancy to be there, to apologize for his behavior (as justified as it may have been)  man to man. With a gun pointed to his head and monster chasing after him, Steve had every right to run the fuck away. It had nothing to do with him. With keys in hand, ready to start his car and drive to safety, Steve ran back in and saved Jonathan (the guy he still thinks took his girlfriend) from the Demogorgon. Are we out of our minds here? Every one of Steves actions either had a justified motivation or were straight up heroic. There were hints of self-preservation and teenage-immaturity from time to time, but judging the character off of basic human traits is just silly. "
53236,NeoGothica,8a2kk5,2062,2018-04-05,[Spoilers] The one underlying issue I have with the show.,125,"Foreword: love the show overall, and am eagerly anticipating season 3 as much as the next person. But no matter how hard I try, I just can't give a damn about Will Byers.In season 1, Will becomes the McGuffin right off the bat. We're shown how his absence affects the people close to him, so we're able to understand their pain as we get to know the characters and watch them grow. However, we don't get that with Will. Sure, we're shown that he's going through Hell, and we get to know him a little bit, but that's trying to invoke sympathy retroactively (i.e. putting events before character as opposed to character before events).In season 2, Will's back, but he's at a disadvantage. This is our first time seeing him interact with the rest of the world since the beginning of the show, so he might as well be a new character. However, he's quickly reverted back to being the McGuffin when it's shown that he's still going through Hell on Earth, so we again look at everyone else BUT him.Now, I care about what *happens* to Will, because it affects the other characters. As far as Will himself is concerned? I honestly couldn't care less if he drops dead out of nowhere.Will has no character arc. He's such a shameless plot device character that *should* get sympathy, but he doesn't *earn* any because we aren't allowed to have a relationship with him. I *want* to feel for him, but I can't, because I don't *know* him. "
46923,SubatomicArrow,ca08xi,1979,2019-07-06,Pretty darn accurate,50,&amp;#x200B;https://i.redd.it/9pertbnnqr831.jpg
44430,Juiceistasty11,cc6e4o,1921,2019-07-12,Billy's surprisingly significant decision,90,"So, I've been seeing a lot of posts about Billy's sacrifice at the end where he defies the Mindflayer, but the very first time he resisted, at the pool with Karen, was arguably even more significant for the plot. When Karen finds Billy in the pool storage closet, he has an urge from the Mindflayer to attack and presumably flay Karen, but he resists and tells Karen to stay away from him. This small moment was actually key to ensuring the Mindflayer's defeat.Imagine if Billy had gone along with the Mindflayer's plan and successfully kidnapped/flayed Karen. The logical next step would be to flay the rest of the Wheelers, and most importantly, Mike. Then, it would be pretty simple for the Mindflayer to use Mike to trick Eleven and kill/flay her. Even without having Mike under his control, the Mindflayer was nearly able to get Eleven, so with Mike on his side, I don't think Eleven and the crew would've stood a chance. This moment was extremely pivotal for the Mindflayer, and Billy's resistance was absolutely essential for Eleven to ultimately win.TL;DR - in one seemingly insignificant moment, Billy inadvertantly saved Eleven's life and probably the entire town of Hawkins."
59351,MonkWithAKnife,5uzt51,1833,2017-02-19,Why didn't Mike enjoy Christmas?,39,Noel
43829,violetsuzette,cd3q5e,1661,2019-07-14,The Twitter crowd wants to destroy all nuance and momentum from Hop's character and turn him into a Gary Stu,176,"People have been complaining CONSTANTLY about how Hop treated El, Joyce  and Mike this season, and saying they ruined his character. Yes, Hopper is a toxic asshole this season. But its important that he is that way. Its what makes hopper a tragic character. Hopper is a Vietnam war vet with PTSD and a guy who lost his daughter and whose wife left him. And that is all season 1. Hopper has suffered a lot, and seen a lot of shit go wrong, and it has left him bitter and anxious. The thing with Hopper is that he wants the family life, but he has never been a good partner or a good father. He wants these things but he's never been good at them. He's a crappy partner and a controlling dad. But it's what he yearns to have. Hopper is great in a crisis, and useless when the world is normal and happy. That's the tragedy of his character.The reason he is so fucked up is because of his trauma and what he lost, it makes him go crazy to preserve what he has gained. Rather than calling Hop a misogynistic blah blah blah think about how he got this way. People were mad Joyce ""rewarded"" Hopper with a date after his behaviour but it wasn't about rewarding him. It was about them coming to understand each other better. It was about Joyce seeing that there was still something good inside him, seeing that he is a good man underneath the trauma. Hopper is, in a lot of ways, like Billy. An asshole as a product of environment. And it doesn't excuse either of them, but it does help to show that an empathetic person can still reach them and help them heal. So yes, Hop is a psycho and a controlling dick and a jealous manchild at times. But that's part of what makes him a great, conflicted character. If Hop was perfect, he would be boring."
57334,kidwifi,79hpbs,1634,2017-10-29,[Spoilers] The saddest scene,309,"Dustin being rejected and watching him sit alone on the bleachers crying. He spent so much time trying to look good, he was excited and confident because of his hair and teeth, and he gets rejected. No big deal, onto the next girl. Rejected again. We quickly see his smile fade and he feels like no one wants to dance with him. Then we see this lovable kid who has spent the whole season just wanting a friend cry to himself on the bleachers. I cried, Dustin cried, we all cried."
60241,hydruxo,5be4fn,1621,2016-11-06,"On this day 33 years ago, Will Byers went missing.",28,[Happy Stranger Things Day!](https://i.groupme.com/625x309.png.d74a640caf744664bca0910f37b52d95) What are you doing to celebrate today? I'm probably going to do another rewatch. Maybe eat some eggos for breakfast too!
47696,LordZuko,c9l63w,1591,2019-07-05,Did anyone else think that Dustin was going to...,117,...start purring when Suzie said she wanted him to do the thing?
45947,AngryKnifeHandsMan,cap5qh,1577,2019-07-08,[spoilers] Thoughts on Robin and Steve,305,"As a lesbian, I was really happy and surprised that they had a coming out scene in a TV show set in the 80's. However, I've seen a lot of complaints that Robin was leading Steve on with their friendship and the conversation they had where she said she was ""obsessed"" with his popularity when they were both in high school. There are people saying that she should have told him she was gay beforehand.Let me tell ya something, coming out is hard. Even when it's to someone that you 100% know and trust, there's always the little voice in the back of your mind that insists that the person will hate you and never want to hang out with you again. And I came out in 2017! Coming out to a person you don't really know all that well in 1985? Forget it.I think people forget how bad things were for LGBT people not that long ago. Being gay in the 80's was way fucking harder than today. People lost their jobs, were ostracized from their communities, were raped and murdered just for being gay. (And yes, it still happens today!)When I was in high school, I was obsessed with this boy on the baseball team because he got all the girls. In my head I was like ""son of a bitch, I have to figure out how to be like him so that girls will like me."" When Robin said that she was obsessed with Steve, that's the first thing I thought of. She was never romantically interested, she just wanted to figure out how he *did* itWhen Steve confesses his feelings for Robin, I felt so bad for her! I've been in the same exact situation, and her slowly sinking her head into her knees was a big fucking mood, lol. I actually started crying when Steve was so accepting because it almost NEVER happens that way. I had a (former) friend get mad at me and say that I had lead him on, and that I *OWE* it to him to be his girlfriend because of it.I just wish those people complaining realize that Robin never owed Steve a relationship in the first place, and that their friendship is more than good enough. (I'm personally excited to have them be each other's Wingman, because that will be some comedy gold)"
65483,Dark_Saint,4sxzul,1576,2016-07-15,Stranger Things Season 1 Episode Discussion Hub,0,"[S01E01 - The Vanishing Will Beyers](https://www.reddit.com/r/StrangerThings/comments/4sxx4s/episode_discussion_s01e01_the_vanishing_will/)[S01E02 - The Weirdo on Maple Street](https://www.reddit.com/r/StrangerThings/comments/4sxxgd/episode_discussion_s01e02_the_weirdo_on_maple/)[S01E03 - Holly, Jolly](https://www.reddit.com/r/StrangerThings/comments/4sxxp3/episode_discussion_s01e03_holly_jolly/)[S01E04 - The Body](https://www.reddit.com/r/StrangerThings/comments/4sxxxw/episode_discussion_s01e04_the_body/)[S01E05 - The Flea and the Acrobat](https://www.reddit.com/r/StrangerThings/comments/4sxy5i/episode_discussion_s01e05_the_flea_and_the_acrobat/)[S01E06 - The Monster](https://www.reddit.com/r/StrangerThings/comments/4sxyd8/episode_discussion_s01e06_the_monster/)[S01E07 - The Bathtub](https://www.reddit.com/r/StrangerThings/comments/4sxykr/episode_discussion_s01e07_the_bathtub/)[Season Finale S01E08 - The Upside Down](https://www.reddit.com/r/StrangerThings/comments/4sxyyb/season_finale_episode_discussion_s01e08_the/)"
