index,AUTHOR,ID,SCORE,CREATED_DATE,TITLE,NUM_COMMENTS,SELFTEXT
45494,zuluportero,cb50q0,924,2019-07-09,Stop calling out the main characters for not being perfect humans,130,"Hopper is a bad parent and sexist towards Joyce. Max is bad influence on Eleven, Mike is a bad friend. Bal Bla Bla. Why do our characters have to be role models to ourselves? They are not supposed to be. Nowadays in movies and every character has to be flawless cause otherwise you are perpetuating toxic behavior in our society or such bs.   The show intentionally doesn't do that, cause that wasn't a thing in the 80's. Our characters are all antiheroes to a degree. What matters is the intetion behind what they do. Hopper is overprotective cause he lost his daughter once. He is impulsive cause that's funny. The teens are young people with no experience in terms of love, it's all part of their growing process.   So please stop complaining about the characters being toxic bla bla. That's the point. This isn't an education movie, it's entertainment."
45555,Primetime22,cb2lio,909,2019-07-09,Why she insisted on hearing it.,38,"Suzie tells Dustin that she wants to *hear* his rendition of The Neverending Story. She does not say I want to sing it with you.My theory is that Dustin sang her the song at camp and over the few days shes been back in Utah, she learned the song/harmonies herself. She wanted him to sing it because she wanted to surprise him with a duet, which also explains why she was so adamant about it: shes likely been excited about it."
45071,Dark_Saint,cbjvem,878,2019-07-10,Dacre Montgomery AMA - July 11 2019 12pm PST / 3pm EST,112,Dacre Montgomery who plays Billy Hargrove on Stranger Things will stop by and do an AMA with you guys. You can ask him your burning questions about season 3 or his other work.***Reminder that all AMAs will be open to spoilers so if you haven't caught up yet make sure to do so.***
45864,derstherower,carlht,871,2019-07-08,Joyce in Season 1: Hangs things on her walls. Joyce in Season 2: Hangs things on her walls. Joyce in Season 3:,16,"**""WHY CAN'T I HANG THINGS ON MY WALLS?""**"
48657,Dark_Saint,c8zzrq,871,2019-07-04,Stranger Things Season 3 Episode Discussion Hub,0,"[S03E01 - Suzie, Do You Copy?](https://www.reddit.com/r/StrangerThings/comments/c8zh3j/episode_discussion_s03e01_suzie_do_you_copy/)[S03E02 - The Mall Rats](https://www.reddit.com/r/StrangerThings/comments/c8zl60/episode_discussion_s03e02_the_mall_rats/)[S03E03 - The Case of the Missing Lifeguard](https://www.reddit.com/r/StrangerThings/comments/c8zp51/episode_discussion_s03e03_the_case_of_the_missing/)[S03E04 - The Sauna Test](https://www.reddit.com/r/StrangerThings/comments/c8zty7/episode_discussion_s03e04_the_sauna_test/)[S03E05 - The Flayed](https://www.reddit.com/r/StrangerThings/comments/c8zwyf/episode_discussion_s03e05_the_flayed/)[S03E06 - E Pluribus Unum](https://www.reddit.com/r/StrangerThings/comments/c8zzfa/episode_discussion_s03e06_e_pluribus_unum/)"
57481,ScalabrineIsGod,79f0qx,847,2017-10-29,[Spoilers] Dustin was playing the long game this entire time.,23,"I'm a bit drunk right now so sorry if this has already been established and if I don't make sense. My memory of the first season is spotty because I didn't re watch it. Making time is a bitch. In the first season, Dustin is obviously the one with the biggest crush for Nancy among his group. It predictably doesn't go anywhere, due to age difference and lots of stuff, including her dating Steve ""Flow God"" Harrington. Despite that, he gets a good look at Nancy's true personality during all the chaos, and it only helps him in his great game.In the second season, when Max is introduced, we are led to believe that he likes her. This is just a trick to distract us. Lucas was always the only one who had a chance with Max. Dustin ""the Lion"" Henderson had his mind set on a bigger prize. Steve and Nancy were falling apart, and while Jonathan made his moves, successfully, I might add, it was for naught. Nobody stands in the way of the Lion.Dustin knew what he was doing when he and Steve formed their seemingly unlikely duo. Despite all the chaos and shit around him, he was able to get key information out of Steve. He used his ""failed advances"" on Max as a guise for what he planned to later do with Nancy. His clever acting and deception allowed for him to learn what made Steve the Flow God. After all the shit cools down, he ascends into his final form, Flow God 2.0, as he prepares for the dance, and like the mighty hunter he is, goes in for the kill. When Dustin ""Hair so fine it look Divine"" Henderson tells Mike that he is ""going in"" he is telling the truth, but hides the key element. His ""rejection"" at the hands of the other girls is yet another distraction. He foresaw this happening, and knew that Nancy would take pity on the lonely Dustin. His calculations were on point. The moment that she asked him to dance, he completed the circle. Though Steve did it unknowingly, he gave Dustin ""Steal yo bitch"" Henderson the keys. During their dance, when Nancy tells him that he was always her favorite of her brothers group of friends, it serves little point. Flow God 2.0 already knew that long ago. So in short, Dustin played chess while everyone else played checkers. Despite going through all this horrific and traumatizing shit, Dustin displays a cunning drive for success, patience, multitasking, and trickery in getting Nancy. When this series began, he was but the learner. Now from here on, he is the master."
46332,hillarymac,cadr2f,845,2019-07-07,Never ending story scene hit a little to close to home.,32,The last movie I saw with my dad before he died was Neverending Story. I was 6 when he passed. He was involved in a motorcycle accident at the age of 32. Then the scene with Jim Hopper followed by the Dadnote. Im ruined. Way to close. *still crying*
44040,quivorian,ccscyc,842,2019-07-13,Wild Theory with Very Little Evidence Time: Strange Things 4 is already filmed and will surprise debut this Christmas.,150,"Okay, I fully accept that this all sounds incredibly stupid. But hear me out.1) Stranger Things 4, which should ideally have been officially renewed, is still not officially renewed.2) David Harbour is sporting a really wild, badass beard these days. He's been sporting this beard as far back as three months, maybe more.3) There is that weird phone call voice message thing where Murray tells Joyce he has something. Not good, not bad, but something.4) David Harbour is already blabbing stuff -- kinda -- about his fate and the future of Jim Hopper.5) Stranger Things 3 ends with on the hopeful note of meeting again for Christmas.I think, probably entirely wrongly, that Stranger Things 4 was filmed back-to-back with Stranger Things 3 and Netflix is playing coy about the renewal because they want to surprise drop it on fans come Christmastime. David has a beard that an imprisoned Jim would likely have and seems very sure that he is fine, the Murray tease teases... well, summat Jim related, probably. I also don't think the creators want the kids to spend too much time apart and--I'm unraveling here, but yeah.I can say with absolute 5% confidence that Strange Things 4 is already filmed and will surprise debut this Christmas.Whatcha think?"
57357,HeyThereRobot,79h5lt,828,2017-10-29,Joyce is not gonna be happy when...[spoilers],83,...she gets home and finds the demidog in her fridge.
63936,Glennellen,4v35iq,816,2016-07-28,My name is Glennellen Anderson. I played Nicole in Episodes 3 and 6 of Stranger Things. AMA.,190,"Hi loves!  My name is Glennellen, and I play Nicole in STRANGER THINGS (episodes 3 &amp; 6).  I'm the redheaded snitch who rats out Jonathan after catching him in the red room, developing the photos.  So yeah.  I'm a meanie.  Hashtag oops.Getting to be a part of this phenomenal cast and crew has been the most incredible experience.  I adored being onset with such a team of professionals.  The Duffer Bros are genius, the crew made the vision come true, and every single cast member is kind, humble, and hilarious.  We all had way too much fun behind the scenes.  Being a part of this wild ride has truly been an honor.  I would LOVE to tell you guys all about it.  Ask me anything!Pictures and Proof:http://i.imgur.com/Qu9WwoL.jpghttp://i.imgur.com/koXnvhk.jpg[UPDATE 8-6-2016: Wow.  You guys are AWESOME.  I'll be on my vocal rest this entire weekend leading up to a very productive week next week, so I'll be going LOVE again today and tomorrow.  Ask away!  Btw, I'm also a singer/songwriter, so the vocal rest struggle is so real. &lt;3)"
64298,tylerthekitten,4uhnq0,816,2016-07-25,Who else watched all 8 in one day?,128,It's awesome to watch the episodes back to back. However once it's over you wish you stretched it out. But then again I can just watch it over as much as I like! 
52016,sulky22,9ezb0j,815,2018-09-11,Gaten wins Best Lead in a Drama Series in PETA's Elly Awards,63,"Seems [The Elly Awards](https://www.peta.org/features/announcing-peta-ellys-2018-best-tv-stars-animals/) are a new thing *""celebrating TVs most compassionate stars and shows for their promotion of animal-friendly storylines""*. I'm not sure if I'd call Dustin &amp; Dart the greatest example of an animal-friendly storyline - Dustin did cause his other pets to be eaten and he seemed more interested in Dart from a scientific perspective than as an animal-lover. But hey, it's nice for Gaten/Dustin to get singled out for an accolade. I'd also add that Gaten admitted at Comic Con that he'd failed to stay vegetarian. It's a shame they couldn't have given credit to Sadie who is a committed vegan and seems really invested in animal rights activism.   "
55462,BillyHargrove,7bfsyg,812,2017-11-07,What the hell is with all these Steve posts???,78,Harringtons a loser anyway.
40288,DoctorNotorious,cygvu0,799,2019-09-01,I was watching through season 3 again when everything dealing with Billy sunk in...,24,"He could have whatever girl he wanted yet he still kept his gaze set on Karen Wheeler. I think the reason being his deep seated mommy issues. Karen resembled his mother in many ways. She was gorgeous, slim, blonde, and had a son about the same age as him when his mom walked out. Yeah yeah, Oedipus complex, but the part that really hit me was that this is why he was able to resist the Mind Flayer wanting to bash her head in. The only other time we see Billy truly resist the MF was right before his sacrifice. I think the fact that Karen reminded him of his own mother so much and that she chose her family over walking out on them in a sense like Billy's had, is what made Billy control himself enough to tell her to stay away from him. I just think if that's what they meant to portray, they got it across just right in my opinion."
53277,Wombarly,87kzy7,787,2018-03-27,Stranger Things 3: What We Know So Far In Quotes,69,"In the past few days, quite a lot of information has been published about the 8 episode long Stranger Things 3. Most of it coming from Shawn Levy (Executive Producer). I thought it would be useful to have all the information in a single location. The sources of the quotes will be available below, I will probably make another post when a lot of new information comes available. If I forget anything, please let me know (with source) so I can update it.## QuotesAll the quotes I could find. I only listed the once from Levy, as he as of right now is the only one who read the script, any quotes from the acters are from what I can tell speculation on their part.&gt;""We're going to give Will a break,"" he says. ""Were not going to put Will through hell for a third season in a row. Hell be dealing with stuff, but he wont be at rock bottom the way we forced the amazing Noah Schnapp to play. ^[1]-&gt;After battling the Shadow Monster one would assume Dustin or Hopper might be next in line to suffer the consequences. ""You might assume that,"" Levy teases, ""but you would probably end up being wrong. We're [going to be] dealing with forces of evil that are new."" ^[1]-&gt;Levy says you'll definitely ""get some Steve/Dustin action."" ^[1]-&gt;Could rebel Billy be the instigator for a more sexually liberated Mrs. Wheeler next season? ""There was clearly a connection there,"" Levy says. ""Karen has some unhappiness that is brewing. I think that makes her vulnerable to all kinds of things in season three. ^[1]-&gt;Levy says they're ""not commenting"" on Reiser's possible return, mainly because ""I don't have a clear-cut answer for you yet."" In other words, stay tuned. ^[1]-&gt;Hawke will play an alternative girl bored with her mundane day job. She seeks excitement in her life and gets more than she bargained for when she uncovers a dark secret in Hawkins, Ind. ^[2]-&gt;Ferguson appeared last season in a guest role as Erica, Lucas strong-willed, little sister. The scene-stealer returns in the next installment with an army of her own friends. No longer content with sitting on the sidelines, Erica finds herself on a wild mission to save Hawkins from a dangerous new threat. ^[2]-&gt;Its very much the Stranger Things I think people know and love. Its big and spooky. Season 3 has legitimately creepy moments and events, but its incredibly warm and character-based because at the end of the day, I think thats what people love most about Stranger Things. ^[3]-&gt;The way [Stranger Things creators the Duffer brothers] build these episodes, it is very much a suspense-driven show. So if you dont want to click through to the next episode, we havent done our job. ^[3]-&gt;""Mike and Eleven and are going strong, so that's a relationship that continues, and same with Mad Max and Lucas. But again, they're like 13- or 14-year-old kids, so what does romance mean at that stage of life? It can never be simple and stable relationships and there's fun to that instability,"" ^[4]-&gt;""We'll definitely get to see some more of Steve Harrington in season three, and I'll just say we won't be abandoning the Dad Steve magic. I don't want to say much more, but I literally feel that we were walking along and we stumbled onto a gold mine with Dad Steve."" ^[4]-&gt;The 1985 film Back to the Future will be a reference in the new season. ^[4]-&gt;Season 3 is set in the summer, so right out of the gate thats a big difference, ^[5]-&gt;The first two seasons were very much school-based. This is that time of year where its not about school, its about the swimming pool and campfires and parades and Fourth of July and fireworks, so theres kind of a poppy fun to Season 3 thats really enjoyable before things inevitably turn super dark. ^[5]-&gt;The shadow monster is still lurking up there out there in the Upside Down. He is determined to find a way to achieve his goals, ^[5]-&gt;He also teased that more casting announcements will be announced, both from established actors and newcomers. ^[5]-&gt;Levy calls Hawke  whose character is described as an alternative girl named Robin  a really exciting, young brand-new face and actor. She came in and auditioned with Joe Keery and had such interesting chemistry and dynamic. Shes just a really spontaneous, in-the-moment actress. ^[5]-&gt;We thought, how fun would it be if we integrate her into some of the plot, Levy said, but shes still super annoying, feisty Erica. Theres a really fun combination of urgency and nuisance that were leaning into with that character. I wont say what happens plot-wise but theres a lot of Erica in season 3. ^[6]-&gt;The Shadow Monster is still out there,"" Levy warned, adding that the danger to come is ""definitely evil related to his agenda, which we learn more about in Season 3."" ^[7]-&gt;We realized early on were not going to stop time, he said. So were not going to pretend that these kids are still 12. Were going to create and dramatize stories that meet kids where they are and that are honest about where theyre at. Season 2 was about the desire to return to normal. Season 3 is about change, the inevitably of change  change is coming for Hawkins, and change is coming for these characters, whether they like it or not. ^[8]-&gt;Im not going to say too much, he said. Theres definitely new love  whether or not its in a love triangle, I dont want to say. ^[8]## Sources[1] https://www.glamour.com/story/stranger-things-season-3-new-details  [2] http://variety.com/2018/tv/news/stranger-things-season-3-new-character-maya-thurman-hawke-1202715637/  [3] http://ew.com/tv/2018/03/26/stranger-things-executive-producer-season-3-is-legitimately-creepy/  [4] https://www.hollywoodreporter.com/live-feed/stranger-things-first-season-3-details-revealed-1097178  [5] http://variety.com/2018/scene/news/stranger-things-executive-producer-reveals-setting-details-season-three-1202736095/  [6] https://www.elle.com/culture/movies-tv/a19599629/stranger-things-season-3-panel-natalia-dyer/  [7] http://www.mtv.com/news/3071005/stranger-things-3-what-we-know/  [8] http://people.com/tv/stranger-things-kids-fight-siblings/"
50420,msophiac,b0qc25,785,2019-03-13,Found Netflix responding to a comment about Stranger Things under the On My Block season 2 trailer,19,They're purposefully keeping content from us...https://i.redd.it/1za8vw90wxl21.png
52640,dittbub,8x9gn4,784,2018-07-09,Its such a relief watching S2 of StrangerThings after watching S2 of WestWorld,123,"Its just so refreshing to watch a show that isn't trying to trick me.  Or confuse me.  Or bring me into a philosophical black hole.    Its just trying to scare the living bejesus out of me, thats all.  With storytelling at its finest.  With so many good guys and heros to root for.  They bring in archetypes you think you're gunna hate, but then the writers turn them into heros too.  Steve is still a really great guy.  "
55130,Legendver2,7cefs9,779,2017-11-12,Mike Wheeler Appreciation thread,133,"I feel there's a lot of undeserved hate towards Mike in season 2, who happens to be one of my fav characters. Sure he's an ass to Max initially, but that's understandable given his age and trauma over the loss of El. But let's remember:- He jumped off a cliff to save his friend.- The only one who gave a shit about saving Will it seems.- The only one who realizes the danger of Dart, and most likely, due to his trauma, took the situation very seriously.- The one who came up with the strategy to spy on the Mind Flayer, and also the first to realize it was spying back- The only one who realizes closing the gate might kill Will before exorcising him first.- Still the little bossy leader of the group when they facing serious shit down in the tunnels until King Steve took overSo let's give mah man some props."
57920,PM_ME_LEGAL_PAPERS,797u3m,772,2017-10-28,Barb 2.0 (full season spoilers),53,"Ok, so what happened to Yertle the Turtle?? Why is no one upset about this? He gets tossed aside to make way for a baby demogorgon, and never shows up again. Like, what the hell, Dustin?! Did you toss him in the trash?"
54910,lightreader,7d5c3v,740,2017-11-15,That Hopper/Mike scene was one of the best in the series.,170,"After Mike and El had their initial reunion, you knew there was a powder keg of emotions ready to explode. I like how Hopper respects Mike enough to suggest a man-to-man talk in the other room, even though it's obvious the rest of them will be able to hear every word they're saying from the living room. Mike lets out a year's worth of frustrations, and Hopper just lets him wail on himpartially because he knows some of it is justified, but mostly because he has to be the adult. And that transition from trying to restrain him to a hug was an almost father/son moment, something Mike really couldn't get from his real parents, as they had no idea what he'd been going through. It was a nice way to cap off Mike's plotline this season of not being able to deal with El's death.The acting was great from both sides. [I even read that it was done in just a couple of takes.](http://www.businessinsider.com/stranger-things-2-hopper-eleven-mike-fight-scenes-2017-11)"
59245,regachoisiah,5xbiim,739,2017-03-03,"If David Harbour actually gets the Cable role, I expect at least one Stranger Things joke from Deadpool.",64,"Some jokes from the top of my head:Cable, you need to relax. Its just morning and youre already pissed off. Remembermornings are for coffee and contemplation.Yes Cable, I know what youre thinking. I TOO would like to have sex with Winona Ryder. I know you never mentioned her name since this movie started but you seem to be the kind of guy whod be into her, wink wink.PANCAKES FOR EVERYBODY! And a single Eggo waffle for you Cable.Jesus Christ, Summers, is your answer to everything just to punch them in the face?! Nate, you can make the jump! Hop on over! Or should I sayhop-per on over!Cable, you have experience with all things upside down, right? Can you twist my head around, it got mixed around after that fight with Arclight. Just like my buddy Cable here, I too have lost my Will to live."
50512,mopsarethebomb,awz8of,721,2019-03-03,Possible [Spoilers] I re-watched the Starcourt Mall teaser again and noticed some glaringly obvious bits of information.,85,"&gt;! So during the mall commercial they show us Walden Books, with ""The Hunt for Red October"" in the window, which isn't a continuity error really, but it did actually come out the previous year in 1984. I very much doubt that any book store would be promoting any book a year after it's initial release, *e-fucking-specially* when (and this is if the mall is opening in July which I assume it is because there are American flags every where) Stephen King would have just put out Skelton Crew, that shit would have 100% been the window book. So, what do the Duffer Brothers want us to glean from THfRO? Well it's been about 15 years since I've read it, but I do know it's about an angry Russian defector coming to America in what is a state of the art submarine, because he feels like it's technology was too great and would cause havoc (among other more personal reasons why he defected).Now, the mall... Is an All American (this just slapped me in the face) subsidiary of Starcourt Industries an (no shit) international Enterprise. I wonder which fucking nation it's from, hmmmmmmmmmmm?So is the mall a way to have Russians spies come to work in America because they'd heard about the technology Hawkins Lab was cooking up? Is the bloody mall itself somehow a camouflauged silent weapon? Hmm? Idfk, but I know something fuckey is up with this mall.But wait, there's more! Thanks to the interruption of Dick Clark's rockin ball drop, we got weird clues like ""When blue and yellow meet in the West"" well, well, fucking, well. During the Starcourt commerical, they for some.... Honestly un-fucking-known reason show us a shot of the clock, which has clearly blue and yellow hands. That's.... Yeah... The silver cat feeds. Yeah, when the clock strikes 12 in that bitch, something is going to go buck ass wild. So that just leads me to believe that The Battle of Starcourt, isn't just going to be a battle that happens to take place there, but Starcourt may be the opposing force. Then I have to think about THfRO again, if Starcourt is the weapon, then does that mean someone is working there that is a spy who is trying to defect? Possibly the chick Steve is working with at the ice cream shop?The commercial just seemed so obvious this time when I watched it, with the whole over the top patriotism, and American flags everywhere, how it seemed to want to shove in our faces how wholesome and American it is.Sorry if any or all of this has been mentioned before, I did a search on the sub before I wrote this insane rant out, and didn't see anything specifically pointing out most of this, hopefully some of you guys want to discuss the theories? !&lt;"
65400,ddaved76,4t8o3c,718,2016-07-17,(Spoilers) Mr. Clark,78,"Let's take a second to appreciate how badass he is. Not only does he legitimately care about the kids (AV club, helping search for Will, taking an interest in the chief/about his daughter, comforting them outside of the assembly, teaching them about other dimensions) he also takes time out from his date with a cute Asian chick to help the gang build a freaking sensory deprivation tank out of the goodness of his heart and for the sake of science and learning. Awesome seeing a two dimensional, competent good teacher and not just a dweeb or secretly sinister character."
53165,Apperyan_,8ex1e6,716,2018-04-25,"After rewatching season 1, I just realized, how did Will even manage to live in the Upside-Down?",130,Do the local supermarkets in Upside-Down Hawkins have food? Is the water in the Upside-Down even *safe* to drink?
44905,weathermore,cbpf34,715,2019-07-11,Something that will most certainly matter in the future...,43,"The Russians bought up much of the property around Hawkins. Joyce expresses that she has received offers on her house. At the end of the season, Joyce's house sells (which is made to seem like it's an emotional decision.)&amp;#x200B;Her house has, in all of the seasons, been a main source of paranormal activity. Personally I think the buyer of the house has other motives."
59162,Dirty_USB,612b0v,710,2017-03-23,I've noticed that all of the dads in this show suck.,86,"Aside from Hop, all of the fathers in this show are bad at being fathers. Mike's dad with his obliviousness, Will's dad with his douchiness, and Eleven's ""papa,"" well...y'know. "
